Entity Name,Patterns,Response
,What is Java?,"Java is an object-oriented, high-level, general-purpose programming language originally designed by James Gosling and further developed by the Oracle Corporation. It is one of the most popular programming languages in the world. To know more about what is Java, Click here and know all the details of Java, Features, and Component."
,Explain about Java Virtual Machine? ,JVM is a program that interprets the intermediate Java byte code and generates the desired output. It is because of byte code and JVM that programs written in Java are highly portable. 
,What are the features of Java?,"Following are the various features of the Java programming language:
High Performance– Using a JIT (Just-In-Time) compiler allows high performance in Java. The JIT compiler converts the Java bytecode into machine language code, which then gets executed by the JVM.
Multi-threading– A thread is a flow of execution. The JVM creates a thread which is called the main thread. Java allows the creation of several threads using either extending the thread class or implementing the Runnable interface.
OOPS Concepts– Java follows various OOPS concepts, namely abstraction, encapsulation, inheritance, object-oriented, and polymorphism
Platform Independency– Java makes use of the Java Virtual Machine or JVM, which allows a single Java program to operate on multiple platforms without any modifications.
You may want to check out Java features in detail here. "
,How does Java enable high performance?,"In the Just-in-Time compilation, the required code is executed at run time. Typically, it involves translating bytecode into machine code and then executing it directly. For enabling high performance, Java can make use of the Just-In-Time compilation. The JIT compiler is enabled by default in Java and gets activated as soon as a method is called. It then compiles the bytecode of the Java method into native machine code. After that, the JVM calls the compiled code directly instead of interpreting it. This grants a performance boost."
,"Differentiate between JVM, JRE, and JDK","Answer: 
Parameters 	JVM	JRE	JDK
Full-Form	Java Virtual Machine	Java Runtime Environment	Java Development Kit
Purpose	It provides a runtime environment to execute Java bytecode. 	It is a set of software tools used for developing Java applications. 	It is a software development environment used to develop Java applications. 
Existence 	It is a runtime instance created when we run a Java class. 	It exists physically.	It exists physically.
Implementation	Its implementation is known as JRE 	It is the implementation of JVM 	
It is an implementation of any one of the below given Java Platforms released by Oracle Corporation:
Standard Edition Java Platform
Enterprise Edition Java Platform
Micro Edition Java Platform"
,What is the JIT compiler?,"JIT compiler runs after the program is executed and compiles the code into a faster form, hosting CPU's native instructing set. JIT can access dynamic runtime information, whereas a standard compiler doesn't and can make better optimizations like inlining functions that are used frequently. "
,"Which Java IDE to use, and why?",
,"A Java IDE is a software that allows Java developers to easily write as well as debug Java programs. It is basically a collection of various programming tools, accessible via a single interface, and several helpful features, such as code completion and syntax highlighting. Codenvy, Eclipse, and NetBeans are some of the most popular Java IDEs.",
,Java is a platform-independent language. Why?,"Java programming language does not depend on any particular hardware or software because it is compiled by the compiler and then converted into byte code. Byte code is platform-independent and can run on multiple systems. The only requirement is Java needs a runtime environment, i.e., JRE, which is a set of tools used for developing Java applications."
,Explain Typecasting,"The concept of assigning a variable of one data type to a variable of another data type. It is not possible for the boolean data type.

It is of two types:
Implicit
Explicit"
,Explain different types of typecasting?,"Answer:
Different types of typecasting are:
Implicit: Storing values from a smaller data type to the larger data type. It is automatically done by the compiler.

Explicit: Storing the value of a larger data type into a smaller data type. This results in information loss:

Truncation: While converting a value from a larger data type to a smaller data type, the extra data would be truncated.
Let us see the code example: 
   float f = 3.14f; 
   int i  = (int) f; 
After execution, i will contain only 3 and would truncate the rest when we go from float to integer. 
Out of Range: Typecasting does not allow to assign value more than its range; if that happens then the data is lost in such case. 
Let us understand this: 
long l = 123456789; 
byte b = (byte) l;      // byte is of not the same range as long so there will be loss of data."
,Questions: Explain access modifiers in Java.,"Access modifiers are predefined keywords in Java that are used to restrict the access of a class, method, constructor, and data member in another class.
Java supports four access modifiers:
Default
Private
Protected
Public
Modifier	Default	Private	Protected	Public
Same class	yes	yes	yes	yes
Same package subclass	yes	no	yes	yes
Same package non-subclass	yes	no	yes	yes
Different package subclass	no	no	yes	yes
Different package non-subclass	no	no	no	yes"
,What are the default values for local variables?,"The local variables are not initialized to any default value, neither primitives nor object references.

OOPS Java Interview Questions"
,What is Object-Oriented Programming? ,"OOPs is a programming paradigm centred around objects rather than functions. It is not a tool or a programming language it is a paradigm that was designed to overcome the flaws of procedural programming. There are many languages that follow OOPs concepts, some popular ones are Java, Python, Ruby and more. Some frameworks also follow OOPs concepts, Angular is one such framework."
,Could you explain the Oops concepts?,"Following are the various OOPS Concepts:
Abstraction– Representing essential features without the need to give out background details. The technique is used for creating a new suitable data type for some specific application
Aggregation– All objects have their separate lifecycle, but ownership is present. No child object can belong to some other object except for the parent object
Association– The relationship between two objects, where each object has its separate lifecycle. There is no ownership
Class– A group of similar entities
Composition– Also called the death relationship, it is a specialized form of aggregation. Child objects don't have a lifecycle. As such, they automatically get deleted if the associated parent object is deleted
Encapsulation– Refers to the wrapping up of data and code into a single entity. Allows the variables of a class to be only accessible by the parent class and no other classes
Inheritance– When an object acquires the properties of some other object, it is called inheritance. It results in the formation of a parent-child relationship amongst classes involved. Offers a robust and natural mechanism of organizing and structuring software
Object– Denotes an instance of a class. Any class can have multiple instances. An object contains the data as well as the method that will operate on the data
Polymorphism– refers to the ability of a method, object, or variable to assume several forms
 
Decision Making Java Interview Questions"
,Questions: Differentiate between break and continue,"Answer:
Break	Continue
Used with both loop and switch statement	Used with only loop statements.
It terminates the loop or switch block.	It does not terminate but skips to the next iteration.
Classes, Objects, and Methods Java Interview Questions"
,What is an Object?,An instance of a Java class is known as an object. Two important properties of a Java object are behaviour and state. An object is created as soon as the JVM comes across the new keyword.
,Define classes in Java ,"A class is a collection of objects of similar data types. Classes are user-defined data types and behave like built-in types of a programming language. 
Syntax of a class: 
class Sample{
member variables
methods() 
}
Example of Class:
public class Shape
   {
      String Shape name;
      void area()
        {
        }
      void volume ()
        {
        }
      void num_sides()
        {
        }
   }"
,Explain what are static methods and variables?,"A class has two sections one declares variables, and other declares method, and these are called instance variables and instance methods, respectively. They are termed so because every time a class is instantiated, a new copy of each of them is created. 
Variables and methods can be created that are common to all objects and accessed without using a particular object by declaring them static. Static members are also available to be used by other classes and methods. "
,What do you mean by Constructor?,"A constructor is a method that has the same name as that of the class to which it belongs. As soon as a new object is created, a constructor corresponding to the class gets invoked. Although the user can explicitly create a constructor, it is created on its own as soon as a class is created. This is known as the default constructor. Constructors can be overloaded.

Note: - If an explicitly-created constructor has a parameter, then it is necessary to create another constructor without a parameter."
,Please explain Local variables and Instance variables in Java.,"Variables that are only accessible to the method or code block in which they are declared are known as local variables. Instance variables, on the other hand, are accessible to all methods in a class. While local variables are declared inside a method or a code block, instance variables are declared inside a class but outside a method. Even when not assigned, instance variables have a value that can be null, 0, 0.0, or false. This isn't the case with local variables that need to be assigned a value, where failing to assign a value will yield an error. Local variables are automatically created when a method is called and destroyed as soon as the method exits. For creating instance variables, the new keyword must be used."
,Please explain Method Overriding in Java?,"Method Overriding in Java allows a subclass to offer a specific implementation of a method that has already been provided by its parent or superclass. Method overriding happens if the subclass method and the Superclass method have:
The same name
The same argument
The same return type"
,What do you mean by Overloading?,"Overloading is the phenomenon when two or more different methods (method overloading) or operators (operator overloading) have the same representation. For example, the + operator adds two integer values but concatenates two strings. Similarly, an overloaded function called Add can be used for two purposes
To add two integers
To concatenate two strings
Unlike method overriding, method overloading requires two overloaded methods to have the same name but different arguments. The overloaded functions may or may not have different return types."
,"What role does the final keyword play in Java? What impact does it have on a variable, method, and class?","The final keyword in Java is a non-access modifier that applies only to a class, method, or variable. It serves a different purpose based on the context where it is used.
With a class
When a class is declared as final, then it is disabled from being subclassed i.e., no class can extend the final class.
With a method
Any method accompanying the final keyword is restricted from being overridden by the subclass.
With a variable
A variable followed by the final keyword is not able to change the value that it holds during the program execution. So, it behaves like a constant.
Arrays, Strings and Vectors Java Interview Questions"
,Could you draw a comparison between Array and ArrayList?,"An array necessitates for giving the size during the time of declaration, while an array list doesn't necessarily require size as it changes size dynamically. To put an object into an array, there is the need to specify the index. However, no such requirement is in place for an array list. While an array list is parameterized, an array is not parameterized."
,"Please explain the difference between String, String Builder, and String Buffer.","String variables are stored in a constant string pool. With the change in the string reference, it becomes impossible to delete the old value. For example, if a string has stored a value ""Old,"" then adding the new value ""New"" will not delete the old value. It will still be there, however, in a dormant state. In a String Buffer, values are stored in a stack. With the change in the string reference, the new value replaces the older value. The String Buffer is synchronized (and therefore, thread-safe) and offers slower performance than the String Builder, which is also a String Buffer but is not synchronized. Hence, performance is fast in String Builder than the String Buffer."
,Questions: What is String Pool in Java?,"The collection of strings stored in the heap memory refers to the String pool. Whenever a new object is created, it is checked if it is already present in the String pool or not. If it is already present, then the same reference is returned to the variable else new object is created in the String pool, and the respective reference is returned.
 
Advanced Java Interview Questions
Interfaces and Abstract Classes Java Interview Questions"
,What do you know about Interface in Java?,"A Java interface is a template that has only method declarations and not method implementations. It is a workaround for achieving multiple inheritances in Java. Some worth remembering important points regarding Java interfaces are:
A class that implements the interface must provide an implementation for all methods declared in the interface
All methods in an interface are internally public abstract void
All variables in an interface are internally public static final
Classes do not extend but implement interfaces"
,How is an Abstract class different from an Interface?,"There are several differences between an Abstract class and an Interface in Java, summed up as follows:
Constituents – An abstract class contains instance variables, whereas an interface can contain only constants.
Constructor and Instantiation – While an interface has neither a constructor nor it can be instantiated, an abstract class can have a default constructor that is called whenever the concrete subclass is instantiated.
Implementation of Methods – All classes that implement the interface need to provide an implementation for all the methods contained by it. A class that extends the abstract class, however, doesn't require implementing all the methods contained in it. Only abstract methods need to be implemented in the concrete subclass.
Type of Methods – Any abstract class has both abstract as well as non-abstract methods. Interface, on the other hand, has only a single abstract method."
,Please explain what do you mean by an Abstract class and an Abstract method?,"An abstract class in Java is a class that can't be instantiated. Such a class is typically used for providing a base for subclasses to extend as well as implementing the abstract methods and overriding or using the implemented methods defined in the abstract class. To create an abstract class, it needs to be followed by the abstract keyword. Any abstract class can have both abstract as well as non-abstract methods. A method in Java that only has the declaration and not implementation is known as an abstract method. Also, an abstract method name is followed by the abstract keyword. Any concrete subclass that extends the abstract class must provide an implementation for abstract methods."
,"Questions: What is multiple inheritance? Does Java support multiple inheritance? If not, how can it be achieved?","If a subclass or child class has two parent classes, that means it inherits the properties from two base classes, it is multiple inheritances. Java does not multiple inheritances as in case if the parent classes have the same method names, then at runtime, it becomes ambiguous, and the compiler is unable to decide which method to execute from the child class.
Packages Java Interview Questions"
,What are the packages in Java? State some advantages of Packages in Java?,"Packages are Java's way of grouping a variety of classes and/or interfaces together. The functionality of the objects decides how they are grouped. Packagers act as ""containers"" to classes.
Enlisted below are the advantages of Packages:
Classes of other programs can be reused.
Two classes with the same can exist in two different packages.
Packages can hide classes, thus denying access to certain programs and classes meant for internal use only.
They also separate design from coding.
Multithreading Java Interview Questions"
,How do you make a thread in Java? Give examples.,"To make a thread in Java, there are two options:
Extend the Thread Class – The thread is available in the java.lang.Thread class. To make a thread, you need to extend a thread class and override the run method. For example,
public class Addition extends Thread {
public void run() {
}
}
A disadvantage of using the thread class is that it becomes impossible to extend any other classes.
Nonetheless, it is possible to overload the run() method in the class

Implement Runnable Interface – Another way of making a thread in Java is by implementing a runnable interface. For doing so, there is the need to provide the implementation for the run() method that is defined in the
interface. For example,
public class Addition implements Runnable {
public void run() {
}
}"
,Why do we use the yield() method?,"The yield() method belongs to the thread class. It transfers the currently running thread to a runnable state and also allows the other threads to execute. In other words, it gives equal priority threads a chance to run. Because yield() is a static method, it does not release any lock."
,Can you explain the thread lifecycle in Java?,"The thread lifecycle has the following states and follows the following order:
New – In the very first state of the thread lifecycle, the thread instance is created, and the start() method is yet to be invoked. The thread is considered alive now.
Runnable – After invoking the start() method, but before invoking the run() method, a thread is in the runnable state. A thread can also return to the runnable state from waiting or sleeping state.
Running – The thread enters the running state after the run() method is invoked. This is when the thread begins execution.
Non-Runnable – Although the thread is alive, it is not able to run. Typically, it returns to the runnable state after some time.
Terminated – The thread enters the terminated state once the run() method completes its execution. It is not alive now."
,When is the Runnable interface preferred over thread class and vice-versa?,"In Java, it is possible to extend only one class. Hence, the thread class is only extended when no other class needs to be extended. If it is required for a class to extend some other class than the thread class, then we need to use the Runnable interface."
,Please draw a comparison between notify() and notifyAll() methods.,"The notify() method is used for sending a signal to wake up a single thread in the waiting pool. Contrarily, the notifyAll() method is used for sending a signal to wake up all threads in a waiting pool."
,How will you distinguish processes from threads?,"There are several fundamental differences between a process and a thread, stated as follows:
Definition – A process is an executing instance of a program whereas, a thread is a subset of a process.
Changes – A change made to the parent process doesn't affect child processes. However, a change in the main thread can yield changes in the behavior of other threads of the same process.
Communication – While processes require inter-process communication for communicating with sibling processes, threads can directly communicate with other threads belonging to the same process.
Control – Processes are controlled by the operating system and can control only child processes. On the contrary, threads are controlled by the programmer and are capable of exercising control over threads of the same process to which they belong.
Dependence – Processes are independent entities while threads are dependent entities
Memory – Threads run in shared memory spaces, but processes run in separate memory spaces."
,What is the join() method? Give an example.,"We use the join() method for joining one thread with the end of the currently running thread. It is a non-static method and has an overloaded version. Consider the example below:
public static void main (String[] args) {
Thread t = new Thread();
t.start();
t.join();
}
The main thread starts execution in the example mentioned above. As soon as the execution reaches the code t.start(), then the thread t starts its stack for execution. The JVM switches between the main thread and the thread there. Once the execution reaches the t.join(), then the thread t alone is executed and allowed to complete its task. Afterward, the main thread resumes execution."
,How do you make a thread stop in Java?,"There are three methods in Java to stop the execution of a thread:
Blocking – This method is used to put the thread in a blocked state. The execution resumes as soon as the condition of the blocking is met. For instance, the ServerSocket.accept() is a blocking method that listens for incoming socket connection and resumes the blocked thread only when a connection is made.
Sleeping – This method is used for delaying the execution of the thread for some time. A thread upon which the sleep() method is used is said to enter the sleep state. It enters the runnable state as soon as it wakes up i.e., the sleep state is finished. The time for which the thread needs to enter the sleep state is mentioned inside the braces of the sleep() method. It is a static method.
Waiting – Although it can be called on any Java object, the wait() method can only be called from a synchronized block.
Exception Handling Java Interview Questions"
,"Could you explain various types of Exceptions in Java? Also, tell us about the different ways of handling them.","Java has provision for two types of exceptions:
Checked Exceptions – Classes that extend Throwable class, except Runtime exception and Error, are called checked exceptions. Such exceptions are checked by the compiler during the compile time. These types of exceptions must either have appropriate try/catch blocks or be declared using the throws keyword. ClassNotFoundException is a checked exception.
Unchecked Exceptions – Such exceptions aren't checked by the compiler during the compile time. As such, the compiler doesn't necessitate handling unchecked exceptions. Arithmetic Exception and ArrayIndexOutOfBounds Exception are unchecked exceptions.
Exceptions in Java are handled in two ways:
Declaring the throws keyword – We can declare the exception using throws keyword at the end of the method. For example:
class ExceptionCheck{
public static void main(String[] args){
add();
}
public void add() throws Exception{
addition();
}
}
Using try/catch – Any code segment that is expected to yield an exception is surrounded by the try block. Upon the occurrence of the exception, it is caught by the catch block that follows the try block. For example,
class ExceptionCheck{
public static void main (String[] args) {
add();
}
public void add(){
try{
addition();
}
catch(Exception e)
{
e.printStacktrace();
}
}
}"
,Could you draw the Java Exception Hierarchy?,Answer:  
,Is it possible to write multiple catch blocks under a single try block?,"Yes, it is possible to write several catch blocks under a single try block. However, the approach needs to be from specific to general. Following example demonstrates the same:
public class Example {
public static void main(String args[]) {
try {
int a[]= new int[10];
a[10]= 10/0;
}
catch(ArithmeticException e)
{
System.out.println(""Arithmetic exception in first catch block"");
}
catch(ArrayIndexOutOfBoundsException e)
{
System.out.println(""Array index out of bounds in second catch block"");
}
catch(Exception e)
{
System.out.println(""Any exception in third catch block"");
}
}"
,How does the throw keyword differ from the throws keyword?,"While the throws keyword allows declaring an exception, the throw keyword is used to explicitly throw an exception. Checked exceptions can't be propagated with throw only, but throws allow doing so without the need for anything else. The throws keyword is followed by a class, whereas the throw keyword is followed by an instance. The throw keyword is used within the method, but the throws keyword is used with the method signature. Furthermore, it is not possible to throw multiple exceptions, but it is possible to declare multiple exceptions."
